{
  "criterion": {
    "graph_id": "/Game/Probe/BP_SlicingProbe.BP_SlicingProbe:EventGraph",
    "member_guid": "0fdf8c87-4cc0-0093-a246-d2a760d4d912",
    "member_name": "Health",
    "question": "Rule-selected data member: the member GUID with the most Set nodes."
  },
  "excluded_regions": [
    "/Game/Probe/BP_SlicingProbe.BP_SlicingProbe:UserConstructionScript: excluded because slicing is graph-local to EventGraph",
    "No downstream consumers of a member Get are selected (data rule 8)",
    "14 of 24 nodes in this graph are not reachable under the frozen rules from this criterion and are excluded"
  ],
  "expected": {
    "counts": {
      "data_edges": 6,
      "edges": 8,
      "execution_edges": 2,
      "nodes": 10
    },
    "edge_ids": [
      "/Game/Probe/BP_SlicingProbe.BP_SlicingProbe:EventGraph::edge::/Game/Probe/BP_SlicingProbe.BP_SlicingProbe:EventGraph::node::5376fc7c-4cd7-9caf-f9bf-28bca204f9f6::pin::locator-output-then-0->/Game/Probe/BP_SlicingProbe.BP_SlicingProbe:EventGraph::node::13d7ef2c-4b09-98a1-fc29-ae9e5e596d3d::pin::locator-input-execute-0",
      "/Game/Probe/BP_SlicingProbe.BP_SlicingProbe:EventGraph::edge::/Game/Probe/BP_SlicingProbe.BP_SlicingProbe:EventGraph::node::b65b6930-4042-ba18-ea89-79b906d351ec::pin::locator-output-Health-0->/Game/Probe/BP_SlicingProbe.BP_SlicingProbe:EventGraph::node::d609619c-44bc-d2f0-ef2a-aba7f13d1ea7::pin::locator-input-A-0",
      "/Game/Probe/BP_SlicingProbe.BP_SlicingProbe:EventGraph::edge::/Game/Probe/BP_SlicingProbe.BP_SlicingProbe:EventGraph::node::bf005569-4334-c0d8-3ed9-91afa33e9ce2::pin::locator-output-Health-0->/Game/Probe/BP_SlicingProbe.BP_SlicingProbe:EventGraph::node::efbd1d7a-47d3-fd55-7775-26bd488ee92d::pin::locator-input-CurrentHealth-0",
      "/Game/Probe/BP_SlicingProbe.BP_SlicingProbe:EventGraph::edge::/Game/Probe/BP_SlicingProbe.BP_SlicingProbe:EventGraph::node::cbbd5a81-42fa-5ea1-6363-c09cebb1efb2::pin::locator-output-then-0->/Game/Probe/BP_SlicingProbe.BP_SlicingProbe:EventGraph::node::63180c9c-4c18-1a57-ca71-60b47521033c::pin::locator-input-execute-0",
      "/Game/Probe/BP_SlicingProbe.BP_SlicingProbe:EventGraph::edge::/Game/Probe/BP_SlicingProbe.BP_SlicingProbe:EventGraph::node::d609619c-44bc-d2f0-ef2a-aba7f13d1ea7::pin::locator-output-ReturnValue-0->/Game/Probe/BP_SlicingProbe.BP_SlicingProbe:EventGraph::node::cbbd5a81-42fa-5ea1-6363-c09cebb1efb2::pin::locator-input-Condition-0",
      "/Game/Probe/BP_SlicingProbe.BP_SlicingProbe:EventGraph::edge::/Game/Probe/BP_SlicingProbe.BP_SlicingProbe:EventGraph::node::efbd1d7a-47d3-fd55-7775-26bd488ee92d::pin::locator-output-NewHealth-0->/Game/Probe/BP_SlicingProbe.BP_SlicingProbe:EventGraph::node::13d7ef2c-4b09-98a1-fc29-ae9e5e596d3d::pin::locator-input-Health-0",
      "/Game/Probe/BP_SlicingProbe.BP_SlicingProbe:EventGraph::edge::/Game/Probe/BP_SlicingProbe.BP_SlicingProbe:EventGraph::node::f84a6e45-473e-5019-1800-7f884b5e7b80::pin::locator-output-ReturnValue-0->/Game/Probe/BP_SlicingProbe.BP_SlicingProbe:EventGraph::node::63180c9c-4c18-1a57-ca71-60b47521033c::pin::locator-input-Health-0",
      "/Game/Probe/BP_SlicingProbe.BP_SlicingProbe:EventGraph::edge::/Game/Probe/BP_SlicingProbe.BP_SlicingProbe:EventGraph::node::fd6fa7a3-4434-6992-629e-15bf05340f5a::pin::locator-output-Health-0->/Game/Probe/BP_SlicingProbe.BP_SlicingProbe:EventGraph::node::f84a6e45-473e-5019-1800-7f884b5e7b80::pin::locator-input-A-0"
    ],
    "node_ids": [
      "/Game/Probe/BP_SlicingProbe.BP_SlicingProbe:EventGraph::node::13d7ef2c-4b09-98a1-fc29-ae9e5e596d3d",
      "/Game/Probe/BP_SlicingProbe.BP_SlicingProbe:EventGraph::node::5376fc7c-4cd7-9caf-f9bf-28bca204f9f6",
      "/Game/Probe/BP_SlicingProbe.BP_SlicingProbe:EventGraph::node::63180c9c-4c18-1a57-ca71-60b47521033c",
      "/Game/Probe/BP_SlicingProbe.BP_SlicingProbe:EventGraph::node::b65b6930-4042-ba18-ea89-79b906d351ec",
      "/Game/Probe/BP_SlicingProbe.BP_SlicingProbe:EventGraph::node::bf005569-4334-c0d8-3ed9-91afa33e9ce2",
      "/Game/Probe/BP_SlicingProbe.BP_SlicingProbe:EventGraph::node::cbbd5a81-42fa-5ea1-6363-c09cebb1efb2",
      "/Game/Probe/BP_SlicingProbe.BP_SlicingProbe:EventGraph::node::d609619c-44bc-d2f0-ef2a-aba7f13d1ea7",
      "/Game/Probe/BP_SlicingProbe.BP_SlicingProbe:EventGraph::node::efbd1d7a-47d3-fd55-7775-26bd488ee92d",
      "/Game/Probe/BP_SlicingProbe.BP_SlicingProbe:EventGraph::node::f84a6e45-473e-5019-1800-7f884b5e7b80",
      "/Game/Probe/BP_SlicingProbe.BP_SlicingProbe:EventGraph::node::fd6fa7a3-4434-6992-629e-15bf05340f5a"
    ]
  },
  "format": "blueprint-lens-ground-truth",
  "review": {
    "annotators": [
      "controller_round_b"
    ],
    "notes": "Round B, rule-selected supplement. Derived by reading the frozen specifications and traversing the typed IR; no M4 or M5 slice kernel was consulted. Not yet independently re-derived, so this is a candidate rather than reviewed truth.",
    "reviewed_at": "2026-08-22",
    "status": "candidate"
  },
  "rules_version": "1.0.0",
  "schema_version": "1.0.0",
  "slice_kind": "member_variable_data_dependency",
  "source_fixture": "60fb3c769ebf10e0a24a0217d14cfd19c168b7e294ca7d9f9c26cb10b59e6386.blueprint-lens-v1.json",
  "source_sha256": "0841255D9D523BDA0ECAE105A2EC2CBA39F28FB2F4AFE99DBED1CD8E2C4B5CCD"
}
