{
  "criterion": {
    "description": "Rule-selected execution criterion: the node with the longest backward supported-execution chain.",
    "graph_id": "/Game/LensCorpus/BP_LensCorpus_Main.BP_LensCorpus_Main:CallService",
    "node_id": "/Game/LensCorpus/BP_LensCorpus_Main.BP_LensCorpus_Main:CallService::node::b76d106f-4c35-5194-d976-43b73c9e4b53"
  },
  "excluded_regions": [
    "/Game/LensCorpus/BP_LensCorpus_Main.BP_LensCorpus_Main:UserConstructionScript: excluded because slicing is graph-local to CallService",
    "No forward context is selected after the criterion (forward_context_hops=0)",
    "2 of 5 nodes in this graph are not reachable under the frozen rules from this criterion and are excluded"
  ],
  "expected": {
    "counts": {
      "data_edges": 2,
      "edges": 4,
      "execution_edges": 2,
      "nodes": 3
    },
    "edge_ids": [
      "/Game/LensCorpus/BP_LensCorpus_Main.BP_LensCorpus_Main:CallService::edge::/Game/LensCorpus/BP_LensCorpus_Main.BP_LensCorpus_Main:CallService::node::2ef55eff-443a-869a-ab63-359ce19fd32f::pin::locator-output-then-0->/Game/LensCorpus/BP_LensCorpus_Main.BP_LensCorpus_Main:CallService::node::b76d106f-4c35-5194-d976-43b73c9e4b53::pin::locator-input-execute-0",
      "/Game/LensCorpus/BP_LensCorpus_Main.BP_LensCorpus_Main:CallService::edge::/Game/LensCorpus/BP_LensCorpus_Main.BP_LensCorpus_Main:CallService::node::c4e267c7-4871-a9fa-06e2-d6b54321057b::pin::locator-output-Accepted-0->/Game/LensCorpus/BP_LensCorpus_Main.BP_LensCorpus_Main:CallService::node::2ef55eff-443a-869a-ab63-359ce19fd32f::pin::locator-input-IsServiceAccepted-0",
      "/Game/LensCorpus/BP_LensCorpus_Main.BP_LensCorpus_Main:CallService::edge::/Game/LensCorpus/BP_LensCorpus_Main.BP_LensCorpus_Main:CallService::node::c4e267c7-4871-a9fa-06e2-d6b54321057b::pin::locator-output-Accepted-0->/Game/LensCorpus/BP_LensCorpus_Main.BP_LensCorpus_Main:CallService::node::b76d106f-4c35-5194-d976-43b73c9e4b53::pin::locator-input-Accepted-0",
      "/Game/LensCorpus/BP_LensCorpus_Main.BP_LensCorpus_Main:CallService::edge::/Game/LensCorpus/BP_LensCorpus_Main.BP_LensCorpus_Main:CallService::node::c4e267c7-4871-a9fa-06e2-d6b54321057b::pin::locator-output-then-0->/Game/LensCorpus/BP_LensCorpus_Main.BP_LensCorpus_Main:CallService::node::2ef55eff-443a-869a-ab63-359ce19fd32f::pin::locator-input-execute-0"
    ],
    "node_ids": [
      "/Game/LensCorpus/BP_LensCorpus_Main.BP_LensCorpus_Main:CallService::node::2ef55eff-443a-869a-ab63-359ce19fd32f",
      "/Game/LensCorpus/BP_LensCorpus_Main.BP_LensCorpus_Main:CallService::node::b76d106f-4c35-5194-d976-43b73c9e4b53",
      "/Game/LensCorpus/BP_LensCorpus_Main.BP_LensCorpus_Main:CallService::node::c4e267c7-4871-a9fa-06e2-d6b54321057b"
    ]
  },
  "format": "blueprint-lens-ground-truth",
  "review": {
    "annotators": [
      "controller_round_b"
    ],
    "notes": "Round B, rule-selected supplement. Derived by reading the frozen specifications and traversing the typed IR; no M4 or M5 slice kernel was consulted. Not yet independently re-derived, so this is a candidate rather than reviewed truth.",
    "reviewed_at": "2026-08-22",
    "status": "candidate"
  },
  "rules_version": "1.0.0",
  "schema_version": "1.0.0",
  "slice_kind": "execution_context",
  "source_fixture": "8ca0b6a00f2943b8672a1308934442b81e1e88fb2cc366c0805668e872ba7661.blueprint-lens-v1.json",
  "source_sha256": "AE3081275ADA00B7370F17695B111C13F86E29A0707BA3B722E48AC48DED9E8F"
}
