{
  "criterion": {
    "description": "Rule-selected execution criterion: the node with the longest backward supported-execution chain.",
    "graph_id": "/Game/LensCorpus/BP_LensCorpus_Main.BP_LensCorpus_Main:EvaluateEncounter",
    "node_id": "/Game/LensCorpus/BP_LensCorpus_Main.BP_LensCorpus_Main:EvaluateEncounter::node::d121002b-44ff-50fc-db72-75bfb3246831"
  },
  "excluded_regions": [
    "/Game/LensCorpus/BP_LensCorpus_Main.BP_LensCorpus_Main:UserConstructionScript: excluded because slicing is graph-local to EvaluateEncounter",
    "No forward context is selected after the criterion (forward_context_hops=0)",
    "1 of 11 nodes in this graph are not reachable under the frozen rules from this criterion and are excluded"
  ],
  "expected": {
    "counts": {
      "data_edges": 5,
      "edges": 14,
      "execution_edges": 9,
      "nodes": 10
    },
    "edge_ids": [
      "/Game/LensCorpus/BP_LensCorpus_Main.BP_LensCorpus_Main:EvaluateEncounter::edge::/Game/LensCorpus/BP_LensCorpus_Main.BP_LensCorpus_Main:EvaluateEncounter::node::0988c876-4804-1d3b-ee91-ed86086514b8::pin::locator-output-then-0->/Game/LensCorpus/BP_LensCorpus_Main.BP_LensCorpus_Main:EvaluateEncounter::node::d121002b-44ff-50fc-db72-75bfb3246831::pin::locator-input-execute-0",
      "/Game/LensCorpus/BP_LensCorpus_Main.BP_LensCorpus_Main:EvaluateEncounter::edge::/Game/LensCorpus/BP_LensCorpus_Main.BP_LensCorpus_Main:EvaluateEncounter::node::161a2cc2-4fa8-0c63-1a65-3a8208f616f2::pin::locator-output-ArmorValue-0->/Game/LensCorpus/BP_LensCorpus_Main.BP_LensCorpus_Main:EvaluateEncounter::node::69d60620-4e54-5210-0757-60b7147f2dfd::pin::locator-input-A-0",
      "/Game/LensCorpus/BP_LensCorpus_Main.BP_LensCorpus_Main:EvaluateEncounter::edge::/Game/LensCorpus/BP_LensCorpus_Main.BP_LensCorpus_Main:EvaluateEncounter::node::161a2cc2-4fa8-0c63-1a65-3a8208f616f2::pin::locator-output-HealthValue-0->/Game/LensCorpus/BP_LensCorpus_Main.BP_LensCorpus_Main:EvaluateEncounter::node::376fdf7e-436d-f921-04ef-f5a79bce5c7a::pin::locator-input-A-0",
      "/Game/LensCorpus/BP_LensCorpus_Main.BP_LensCorpus_Main:EvaluateEncounter::edge::/Game/LensCorpus/BP_LensCorpus_Main.BP_LensCorpus_Main:EvaluateEncounter::node::161a2cc2-4fa8-0c63-1a65-3a8208f616f2::pin::locator-output-ThreatValue-0->/Game/LensCorpus/BP_LensCorpus_Main.BP_LensCorpus_Main:EvaluateEncounter::node::69d60620-4e54-5210-0757-60b7147f2dfd::pin::locator-input-B-0",
      "/Game/LensCorpus/BP_LensCorpus_Main.BP_LensCorpus_Main:EvaluateEncounter::edge::/Game/LensCorpus/BP_LensCorpus_Main.BP_LensCorpus_Main:EvaluateEncounter::node::161a2cc2-4fa8-0c63-1a65-3a8208f616f2::pin::locator-output-then-0->/Game/LensCorpus/BP_LensCorpus_Main.BP_LensCorpus_Main:EvaluateEncounter::node::7a8d77d9-4808-25a4-27c2-1c89efeb0880::pin::locator-input-execute-0",
      "/Game/LensCorpus/BP_LensCorpus_Main.BP_LensCorpus_Main:EvaluateEncounter::edge::/Game/LensCorpus/BP_LensCorpus_Main.BP_LensCorpus_Main:EvaluateEncounter::node::376fdf7e-436d-f921-04ef-f5a79bce5c7a::pin::locator-output-ReturnValue-0->/Game/LensCorpus/BP_LensCorpus_Main.BP_LensCorpus_Main:EvaluateEncounter::node::7a8d77d9-4808-25a4-27c2-1c89efeb0880::pin::locator-input-Condition-0",
      "/Game/LensCorpus/BP_LensCorpus_Main.BP_LensCorpus_Main:EvaluateEncounter::edge::/Game/LensCorpus/BP_LensCorpus_Main.BP_LensCorpus_Main:EvaluateEncounter::node::4091bcad-432a-3718-d733-3ab29eeb0c9f::pin::locator-output-then-0->/Game/LensCorpus/BP_LensCorpus_Main.BP_LensCorpus_Main:EvaluateEncounter::node::0988c876-4804-1d3b-ee91-ed86086514b8::pin::locator-input-execute-0",
      "/Game/LensCorpus/BP_LensCorpus_Main.BP_LensCorpus_Main:EvaluateEncounter::edge::/Game/LensCorpus/BP_LensCorpus_Main.BP_LensCorpus_Main:EvaluateEncounter::node::50273b7f-433a-c06d-1889-328fcf6c5f2a::pin::locator-output-else-0->/Game/LensCorpus/BP_LensCorpus_Main.BP_LensCorpus_Main:EvaluateEncounter::node::4091bcad-432a-3718-d733-3ab29eeb0c9f::pin::locator-input-execute-0",
      "/Game/LensCorpus/BP_LensCorpus_Main.BP_LensCorpus_Main:EvaluateEncounter::edge::/Game/LensCorpus/BP_LensCorpus_Main.BP_LensCorpus_Main:EvaluateEncounter::node::50273b7f-433a-c06d-1889-328fcf6c5f2a::pin::locator-output-then-0->/Game/LensCorpus/BP_LensCorpus_Main.BP_LensCorpus_Main:EvaluateEncounter::node::54ee58ce-41ab-65cc-5a51-03a178ab1811::pin::locator-input-execute-0",
      "/Game/LensCorpus/BP_LensCorpus_Main.BP_LensCorpus_Main:EvaluateEncounter::edge::/Game/LensCorpus/BP_LensCorpus_Main.BP_LensCorpus_Main:EvaluateEncounter::node::54ee58ce-41ab-65cc-5a51-03a178ab1811::pin::locator-output-then-0->/Game/LensCorpus/BP_LensCorpus_Main.BP_LensCorpus_Main:EvaluateEncounter::node::0988c876-4804-1d3b-ee91-ed86086514b8::pin::locator-input-execute-0",
      "/Game/LensCorpus/BP_LensCorpus_Main.BP_LensCorpus_Main:EvaluateEncounter::edge::/Game/LensCorpus/BP_LensCorpus_Main.BP_LensCorpus_Main:EvaluateEncounter::node::69d60620-4e54-5210-0757-60b7147f2dfd::pin::locator-output-ReturnValue-0->/Game/LensCorpus/BP_LensCorpus_Main.BP_LensCorpus_Main:EvaluateEncounter::node::50273b7f-433a-c06d-1889-328fcf6c5f2a::pin::locator-input-Condition-0",
      "/Game/LensCorpus/BP_LensCorpus_Main.BP_LensCorpus_Main:EvaluateEncounter::edge::/Game/LensCorpus/BP_LensCorpus_Main.BP_LensCorpus_Main:EvaluateEncounter::node::7a8d77d9-4808-25a4-27c2-1c89efeb0880::pin::locator-output-else-0->/Game/LensCorpus/BP_LensCorpus_Main.BP_LensCorpus_Main:EvaluateEncounter::node::be88db39-4b56-2182-f0d8-e2a4c6726cea::pin::locator-input-execute-0",
      "/Game/LensCorpus/BP_LensCorpus_Main.BP_LensCorpus_Main:EvaluateEncounter::edge::/Game/LensCorpus/BP_LensCorpus_Main.BP_LensCorpus_Main:EvaluateEncounter::node::7a8d77d9-4808-25a4-27c2-1c89efeb0880::pin::locator-output-then-0->/Game/LensCorpus/BP_LensCorpus_Main.BP_LensCorpus_Main:EvaluateEncounter::node::50273b7f-433a-c06d-1889-328fcf6c5f2a::pin::locator-input-execute-0",
      "/Game/LensCorpus/BP_LensCorpus_Main.BP_LensCorpus_Main:EvaluateEncounter::edge::/Game/LensCorpus/BP_LensCorpus_Main.BP_LensCorpus_Main:EvaluateEncounter::node::be88db39-4b56-2182-f0d8-e2a4c6726cea::pin::locator-output-then-0->/Game/LensCorpus/BP_LensCorpus_Main.BP_LensCorpus_Main:EvaluateEncounter::node::0988c876-4804-1d3b-ee91-ed86086514b8::pin::locator-input-execute-0"
    ],
    "node_ids": [
      "/Game/LensCorpus/BP_LensCorpus_Main.BP_LensCorpus_Main:EvaluateEncounter::node::0988c876-4804-1d3b-ee91-ed86086514b8",
      "/Game/LensCorpus/BP_LensCorpus_Main.BP_LensCorpus_Main:EvaluateEncounter::node::161a2cc2-4fa8-0c63-1a65-3a8208f616f2",
      "/Game/LensCorpus/BP_LensCorpus_Main.BP_LensCorpus_Main:EvaluateEncounter::node::376fdf7e-436d-f921-04ef-f5a79bce5c7a",
      "/Game/LensCorpus/BP_LensCorpus_Main.BP_LensCorpus_Main:EvaluateEncounter::node::4091bcad-432a-3718-d733-3ab29eeb0c9f",
      "/Game/LensCorpus/BP_LensCorpus_Main.BP_LensCorpus_Main:EvaluateEncounter::node::50273b7f-433a-c06d-1889-328fcf6c5f2a",
      "/Game/LensCorpus/BP_LensCorpus_Main.BP_LensCorpus_Main:EvaluateEncounter::node::54ee58ce-41ab-65cc-5a51-03a178ab1811",
      "/Game/LensCorpus/BP_LensCorpus_Main.BP_LensCorpus_Main:EvaluateEncounter::node::69d60620-4e54-5210-0757-60b7147f2dfd",
      "/Game/LensCorpus/BP_LensCorpus_Main.BP_LensCorpus_Main:EvaluateEncounter::node::7a8d77d9-4808-25a4-27c2-1c89efeb0880",
      "/Game/LensCorpus/BP_LensCorpus_Main.BP_LensCorpus_Main:EvaluateEncounter::node::be88db39-4b56-2182-f0d8-e2a4c6726cea",
      "/Game/LensCorpus/BP_LensCorpus_Main.BP_LensCorpus_Main:EvaluateEncounter::node::d121002b-44ff-50fc-db72-75bfb3246831"
    ]
  },
  "format": "blueprint-lens-ground-truth",
  "review": {
    "annotators": [
      "controller_round_b"
    ],
    "notes": "Round B, rule-selected supplement. Derived by reading the frozen specifications and traversing the typed IR; no M4 or M5 slice kernel was consulted. Not yet independently re-derived, so this is a candidate rather than reviewed truth.",
    "reviewed_at": "2026-08-22",
    "status": "candidate"
  },
  "rules_version": "1.0.0",
  "schema_version": "1.0.0",
  "slice_kind": "execution_context",
  "source_fixture": "8ca0b6a00f2943b8672a1308934442b81e1e88fb2cc366c0805668e872ba7661.blueprint-lens-v1.json",
  "source_sha256": "AE3081275ADA00B7370F17695B111C13F86E29A0707BA3B722E48AC48DED9E8F"
}
