{
  "criterion": {
    "description": "Set LC4Complete after the criterion-reaching Sequence outputs reconverge",
    "graph_id": "/Game/LensCorpus/BP_LC4_SequenceDisclosure.BP_LC4_SequenceDisclosure:EventGraph",
    "node_id": "/Game/LensCorpus/BP_LC4_SequenceDisclosure.BP_LC4_SequenceDisclosure:EventGraph::node::da604371-4208-a9cc-a6f3-b388dc461c93"
  },
  "excluded_regions": [
    "/Game/LensCorpus/BP_LC4_SequenceDisclosure.BP_LC4_SequenceDisclosure:UserConstructionScript: excluded because execution-context slicing is graph-local to EventGraph",
    "Sequence ordinal 2 and Set LC4SideEffect: excluded because that connected branch does not reach LC4Complete",
    "Sequence ordinal 3: excluded because the source-owned output is declared but unconnected",
    "No forward context is selected after LC4Complete (forward_context_hops=0)"
  ],
  "expected": {
    "counts": {
      "data_edges": 0,
      "edges": 8,
      "execution_edges": 8,
      "nodes": 8
    },
    "edge_ids": [
      "/Game/LensCorpus/BP_LC4_SequenceDisclosure.BP_LC4_SequenceDisclosure:EventGraph::edge::/Game/LensCorpus/BP_LC4_SequenceDisclosure.BP_LC4_SequenceDisclosure:EventGraph::node::13ea0ba2-4b12-9f49-72f8-faad36310c13::pin::locator-output-then-0->/Game/LensCorpus/BP_LC4_SequenceDisclosure.BP_LC4_SequenceDisclosure:EventGraph::node::da604371-4208-a9cc-a6f3-b388dc461c93::pin::locator-input-execute-0",
      "/Game/LensCorpus/BP_LC4_SequenceDisclosure.BP_LC4_SequenceDisclosure:EventGraph::edge::/Game/LensCorpus/BP_LC4_SequenceDisclosure.BP_LC4_SequenceDisclosure:EventGraph::node::550c6ff9-469c-2849-9e00-289f7d98d82f::pin::locator-output-then_0-0->/Game/LensCorpus/BP_LC4_SequenceDisclosure.BP_LC4_SequenceDisclosure:EventGraph::node::d68f13ea-471b-a090-f0c3-ecadf42e69e8::pin::locator-input-execute-0",
      "/Game/LensCorpus/BP_LC4_SequenceDisclosure.BP_LC4_SequenceDisclosure:EventGraph::edge::/Game/LensCorpus/BP_LC4_SequenceDisclosure.BP_LC4_SequenceDisclosure:EventGraph::node::550c6ff9-469c-2849-9e00-289f7d98d82f::pin::locator-output-then_1-0->/Game/LensCorpus/BP_LC4_SequenceDisclosure.BP_LC4_SequenceDisclosure:EventGraph::node::6ddf096b-45de-a542-c98b-26bdd49c8c37::pin::locator-input-execute-0",
      "/Game/LensCorpus/BP_LC4_SequenceDisclosure.BP_LC4_SequenceDisclosure:EventGraph::edge::/Game/LensCorpus/BP_LC4_SequenceDisclosure.BP_LC4_SequenceDisclosure:EventGraph::node::6ddf096b-45de-a542-c98b-26bdd49c8c37::pin::locator-output-then-0->/Game/LensCorpus/BP_LC4_SequenceDisclosure.BP_LC4_SequenceDisclosure:EventGraph::node::9b3e8e6e-418f-a316-f791-cab3d5addae9::pin::locator-input-execute-0",
      "/Game/LensCorpus/BP_LC4_SequenceDisclosure.BP_LC4_SequenceDisclosure:EventGraph::edge::/Game/LensCorpus/BP_LC4_SequenceDisclosure.BP_LC4_SequenceDisclosure:EventGraph::node::9b3e8e6e-418f-a316-f791-cab3d5addae9::pin::locator-output-then-0->/Game/LensCorpus/BP_LC4_SequenceDisclosure.BP_LC4_SequenceDisclosure:EventGraph::node::13ea0ba2-4b12-9f49-72f8-faad36310c13::pin::locator-input-execute-0",
      "/Game/LensCorpus/BP_LC4_SequenceDisclosure.BP_LC4_SequenceDisclosure:EventGraph::edge::/Game/LensCorpus/BP_LC4_SequenceDisclosure.BP_LC4_SequenceDisclosure:EventGraph::node::d68f13ea-471b-a090-f0c3-ecadf42e69e8::pin::locator-output-then-0->/Game/LensCorpus/BP_LC4_SequenceDisclosure.BP_LC4_SequenceDisclosure:EventGraph::node::ef25b6b2-45d0-4676-14be-1b871d88e0cf::pin::locator-input-execute-0",
      "/Game/LensCorpus/BP_LC4_SequenceDisclosure.BP_LC4_SequenceDisclosure:EventGraph::edge::/Game/LensCorpus/BP_LC4_SequenceDisclosure.BP_LC4_SequenceDisclosure:EventGraph::node::dd625b98-43d7-960d-b1f9-9f9bf86b4362::pin::locator-output-then-0->/Game/LensCorpus/BP_LC4_SequenceDisclosure.BP_LC4_SequenceDisclosure:EventGraph::node::550c6ff9-469c-2849-9e00-289f7d98d82f::pin::locator-input-execute-0",
      "/Game/LensCorpus/BP_LC4_SequenceDisclosure.BP_LC4_SequenceDisclosure:EventGraph::edge::/Game/LensCorpus/BP_LC4_SequenceDisclosure.BP_LC4_SequenceDisclosure:EventGraph::node::ef25b6b2-45d0-4676-14be-1b871d88e0cf::pin::locator-output-then-0->/Game/LensCorpus/BP_LC4_SequenceDisclosure.BP_LC4_SequenceDisclosure:EventGraph::node::13ea0ba2-4b12-9f49-72f8-faad36310c13::pin::locator-input-execute-0"
    ],
    "node_ids": [
      "/Game/LensCorpus/BP_LC4_SequenceDisclosure.BP_LC4_SequenceDisclosure:EventGraph::node::13ea0ba2-4b12-9f49-72f8-faad36310c13",
      "/Game/LensCorpus/BP_LC4_SequenceDisclosure.BP_LC4_SequenceDisclosure:EventGraph::node::550c6ff9-469c-2849-9e00-289f7d98d82f",
      "/Game/LensCorpus/BP_LC4_SequenceDisclosure.BP_LC4_SequenceDisclosure:EventGraph::node::6ddf096b-45de-a542-c98b-26bdd49c8c37",
      "/Game/LensCorpus/BP_LC4_SequenceDisclosure.BP_LC4_SequenceDisclosure:EventGraph::node::9b3e8e6e-418f-a316-f791-cab3d5addae9",
      "/Game/LensCorpus/BP_LC4_SequenceDisclosure.BP_LC4_SequenceDisclosure:EventGraph::node::d68f13ea-471b-a090-f0c3-ecadf42e69e8",
      "/Game/LensCorpus/BP_LC4_SequenceDisclosure.BP_LC4_SequenceDisclosure:EventGraph::node::da604371-4208-a9cc-a6f3-b388dc461c93",
      "/Game/LensCorpus/BP_LC4_SequenceDisclosure.BP_LC4_SequenceDisclosure:EventGraph::node::dd625b98-43d7-960d-b1f9-9f9bf86b4362",
      "/Game/LensCorpus/BP_LC4_SequenceDisclosure.BP_LC4_SequenceDisclosure:EventGraph::node::ef25b6b2-45d0-4676-14be-1b871d88e0cf"
    ]
  },
  "format": "blueprint-lens-ground-truth",
  "review": {
    "annotators": [
      "sequence_source_review",
      "independent_topology_review"
    ],
    "notes": "Reviewed from two byte-identical real UE raw/source exports and the independent compiler-equivalent Sequence order audit before comparison with the generated execution slice.",
    "reviewed_at": "2026-08-14",
    "status": "frozen"
  },
  "rules_version": "1.0.0",
  "schema_version": "1.0.0",
  "slice_kind": "execution_context",
  "source_fixture": "BP_LC4_SequenceDisclosure.ir.v1.json",
  "source_sha256": "06C2E95C0D2F65C83C4E2BBC65CA7076D918C7CCAAC5B93A597FDA9DE89D3D6C"
}
